{
  "credit_warning": "Selection is not identity support. Broad or administrative links and unsupported narrower links receive zero improvement credit.",
  "denominator_policy": "Every expanded artifact remains in its fixed intent-to-treat denominator after research failure, abstention, disagreement, or unsupported scope.",
  "minimum_affected_opportunity_fraction": {
    "denominator": 10,
    "numerator": 1
  },
  "opportunities": [
    {
      "artifact_count": 26573,
      "artifact_expansion_sha256": "4ed9c48e9a1fd9e16ab5255937c998e778ead64b8683667d326d8ada2131724f",
      "intent_to_treat": true,
      "mention_count": 26573,
      "museum": "met",
      "opportunity_id": "opp-0001",
      "selection_rank": 1,
      "selection_reason": "museum_protection_top_10",
      "unresolved_status_counts": {
        "unmatched": 26573
      }
    },
    {
      "artifact_count": 4634,
      "artifact_expansion_sha256": "b7a29652e0086a988cb4ff78ce7cef705ea18846430c104b5558ad9ec22cc045",
      "intent_to_treat": true,
      "mention_count": 4634,
      "museum": "met",
      "opportunity_id": "opp-0002",
      "selection_rank": 2,
      "selection_reason": "museum_protection_top_10",
      "unresolved_status_counts": {
        "unmatched": 4634
      }
    },
    {
      "artifact_count": 3006,
      "artifact_expansion_sha256": "4263acb8bcee29cc95e7b74105ac277f9b7b2f626132663ef59d281982c88c56",
      "intent_to_treat": true,
      "mention_count": 3006,
      "museum": "met",
      "opportunity_id": "opp-0003",
      "selection_rank": 3,
      "selection_reason": "museum_protection_top_10",
      "unresolved_status_counts": {
        "unmatched": 3006
      }
    },
    {
      "artifact_count": 2881,
      "artifact_expansion_sha256": "fcf57fecee9b38ca95a92ee55ded43e2786ff053c9d2f33e7e03b506bbb533d5",
      "intent_to_treat": true,
      "mention_count": 3077,
      "museum": "brooklyn",
      "opportunity_id": "opp-0004",
      "selection_rank": 4,
      "selection_reason": "museum_protection_top_10",
      "unresolved_status_counts": {
        "unmatched": 3077
      }
    },
    {
      "artifact_count": 1927,
      "artifact_expansion_sha256": "02bcc154a491b5be90ebae149dcccd56fa037bd13fe82318856e5cb556666e99",
      "intent_to_treat": true,
      "mention_count": 1927,
      "museum": "met",
      "opportunity_id": "opp-0005",
      "selection_rank": 5,
      "selection_reason": "museum_protection_top_10",
      "unresolved_status_counts": {
        "unmatched": 1927
      }
    },
    {
      "artifact_count": 1518,
      "artifact_expansion_sha256": "1416350c71a77b906eb158bf79bfc6e20d02e72269e063d838583d85eed97ede",
      "intent_to_treat": true,
      "mention_count": 1518,
      "museum": "met",
      "opportunity_id": "opp-0006",
      "selection_rank": 6,
      "selection_reason": "museum_protection_top_10",
      "unresolved_status_counts": {
        "unmatched": 1518
      }
    },
    {
      "artifact_count": 1359,
      "artifact_expansion_sha256": "7e909058e2c1d671086acdad08c8339e48252b822b0e7820d143c097acac6474",
      "intent_to_treat": true,
      "mention_count": 1359,
      "museum": "met",
      "opportunity_id": "opp-0007",
      "selection_rank": 7,
      "selection_reason": "museum_protection_top_10",
      "unresolved_status_counts": {
        "unmatched": 1359
      }
    },
    {
      "artifact_count": 1125,
      "artifact_expansion_sha256": "34ddf41655fe45dd7a3fdd143e7eefb8c2e0f48188df95dfd9d3c140571d6e3b",
      "intent_to_treat": true,
      "mention_count": 1125,
      "museum": "met",
      "opportunity_id": "opp-0008",
      "selection_rank": 8,
      "selection_reason": "museum_protection_top_10",
      "unresolved_status_counts": {
        "unmatched": 1125
      }
    },
    {
      "artifact_count": 997,
      "artifact_expansion_sha256": "8a4362b052c83243dc5003457c26e3e7599f1b488750fcd15bebe7c65c021766",
      "intent_to_treat": true,
      "mention_count": 997,
      "museum": "met",
      "opportunity_id": "opp-0009",
      "selection_rank": 9,
      "selection_reason": "museum_protection_top_10",
      "unresolved_status_counts": {
        "unmatched": 997
      }
    },
    {
      "artifact_count": 997,
      "artifact_expansion_sha256": "8a4362b052c83243dc5003457c26e3e7599f1b488750fcd15bebe7c65c021766",
      "intent_to_treat": true,
      "mention_count": 997,
      "museum": "met",
      "opportunity_id": "opp-0010",
      "selection_rank": 10,
      "selection_reason": "museum_protection_top_10",
      "unresolved_status_counts": {
        "unmatched": 997
      }
    },
    {
      "artifact_count": 920,
      "artifact_expansion_sha256": "27f333b2cc665874e32cab4ab61754101aa564f0d967dcaff6a18ed24757609b",
      "intent_to_treat": true,
      "mention_count": 920,
      "museum": "met",
      "opportunity_id": "opp-0011",
      "selection_rank": 11,
      "selection_reason": "museum_protection_top_10",
      "unresolved_status_counts": {
        "unmatched": 920
      }
    },
    {
      "artifact_count": 908,
      "artifact_expansion_sha256": "4d3d976598a77b4575e6f5aee7ad2a971e4b193110256d6d5d058a0d2773c307",
      "intent_to_treat": true,
      "mention_count": 908,
      "museum": "met",
      "opportunity_id": "opp-0012",
      "selection_rank": 12,
      "selection_reason": "global_frequency_fill_to_50",
      "unresolved_status_counts": {
        "unmatched": 908
      }
    },
    {
      "artifact_count": 717,
      "artifact_expansion_sha256": "f532693e17b7b08d8d01794ffc35b3f21b45f53e87c92ff8c2a78eca03be646f",
      "intent_to_treat": true,
      "mention_count": 717,
      "museum": "met",
      "opportunity_id": "opp-0013",
      "selection_rank": 13,
      "selection_reason": "global_frequency_fill_to_50",
      "unresolved_status_counts": {
        "unmatched": 717
      }
    },
    {
      "artifact_count": 570,
      "artifact_expansion_sha256": "89f65b81be8229795ab1cd84b422c00d659d52e7e332344b6d76b63af9dccc3a",
      "intent_to_treat": true,
      "mention_count": 570,
      "museum": "met",
      "opportunity_id": "opp-0014",
      "selection_rank": 14,
      "selection_reason": "global_frequency_fill_to_50",
      "unresolved_status_counts": {
        "unmatched": 570
      }
    },
    {
      "artifact_count": 552,
      "artifact_expansion_sha256": "ba4f5d84ea87cbeeeff3ce349777fd2184f6259bdcf0585514c42dcc4e6e2c03",
      "intent_to_treat": true,
      "mention_count": 552,
      "museum": "met",
      "opportunity_id": "opp-0015",
      "selection_rank": 15,
      "selection_reason": "global_frequency_fill_to_50",
      "unresolved_status_counts": {
        "unmatched": 552
      }
    },
    {
      "artifact_count": 534,
      "artifact_expansion_sha256": "9f918f4df57141f6f21c9d7a1a71368b7fe53a48b7ddb45c0f8198a1d8723882",
      "intent_to_treat": true,
      "mention_count": 535,
      "museum": "harvard",
      "opportunity_id": "opp-0016",
      "selection_rank": 16,
      "selection_reason": "museum_protection_top_10",
      "unresolved_status_counts": {
        "unmatched": 535
      }
    },
    {
      "artifact_count": 511,
      "artifact_expansion_sha256": "2aade4c5587bdbee61eaedeb696beaf1575410aee4257db3aa9088ce32775aa1",
      "intent_to_treat": true,
      "mention_count": 512,
      "museum": "harvard",
      "opportunity_id": "opp-0017",
      "selection_rank": 17,
      "selection_reason": "museum_protection_top_10",
      "unresolved_status_counts": {
        "unmatched": 512
      }
    },
    {
      "artifact_count": 505,
      "artifact_expansion_sha256": "11faafd463e4deac18a49a8694433639bd672925b8170ad77b8b3be0c7baa5d1",
      "intent_to_treat": true,
      "mention_count": 505,
      "museum": "met",
      "opportunity_id": "opp-0018",
      "selection_rank": 18,
      "selection_reason": "global_frequency_fill_to_50",
      "unresolved_status_counts": {
        "unmatched": 505
      }
    },
    {
      "artifact_count": 452,
      "artifact_expansion_sha256": "aad69dbcba06f85ba1da171fc798ad97448ad7057c0779d038eac0e326a38541",
      "intent_to_treat": true,
      "mention_count": 452,
      "museum": "met",
      "opportunity_id": "opp-0019",
      "selection_rank": 19,
      "selection_reason": "global_frequency_fill_to_50",
      "unresolved_status_counts": {
        "unmatched": 452
      }
    },
    {
      "artifact_count": 430,
      "artifact_expansion_sha256": "e2cf4196c88900e0d7b5bb9baafdfa93ccfdfe699f8dac98b39f1750c7d69cf3",
      "intent_to_treat": true,
      "mention_count": 430,
      "museum": "met",
      "opportunity_id": "opp-0020",
      "selection_rank": 20,
      "selection_reason": "global_frequency_fill_to_50",
      "unresolved_status_counts": {
        "unmatched": 430
      }
    },
    {
      "artifact_count": 414,
      "artifact_expansion_sha256": "d87a02ad5bf2cd6c80c6ca2b650188d809e822ef038c6bda2fb2621c6a4a108e",
      "intent_to_treat": true,
      "mention_count": 414,
      "museum": "met",
      "opportunity_id": "opp-0021",
      "selection_rank": 21,
      "selection_reason": "global_frequency_fill_to_50",
      "unresolved_status_counts": {
        "unmatched": 414
      }
    },
    {
      "artifact_count": 397,
      "artifact_expansion_sha256": "724c7aa8124eb96b19d3986b09b8c8cd6b6ae63f799a5f56da8139c68443132e",
      "intent_to_treat": true,
      "mention_count": 397,
      "museum": "met",
      "opportunity_id": "opp-0022",
      "selection_rank": 22,
      "selection_reason": "global_frequency_fill_to_50",
      "unresolved_status_counts": {
        "unmatched": 397
      }
    },
    {
      "artifact_count": 397,
      "artifact_expansion_sha256": "724c7aa8124eb96b19d3986b09b8c8cd6b6ae63f799a5f56da8139c68443132e",
      "intent_to_treat": true,
      "mention_count": 397,
      "museum": "met",
      "opportunity_id": "opp-0023",
      "selection_rank": 23,
      "selection_reason": "global_frequency_fill_to_50",
      "unresolved_status_counts": {